Paythru Risk Register,,,,,,,,,,,,,,,,,,,,,,,,,
167,May-25,Static,CISO,Business information,Employees,Inconsistent or unsynchronised system clocks result in inaccurate event logs.,"Hindered forensic investigations, inability to prove compliance, or delayed incident response.","All servers and network devices synchronise time using NTP to a trusted, central time source. Clock synchronisation monitored by automated systems and checked regularly.",4,4,2,10,2,20,Modify,"Our time management for our production hosted infrastructure is robust, however our time management for our administrative and clerical environments needs improvement as many endpoint clocks are not on enforced synchronisation. Risk #83 is a pre-requisite of addressing this.",,,,,,,,,A.8.17
168,May-25,Static,CISO,Business information,Employees,Privileged utility programmes are misused by unauthorised users to bypass security controls.,"System compromise, unauthorised changes, or data manipulation with severe operational or financial impact.",,3,3,2,8,2,16,Modify,When Risk #83 is resolved this will also be resolved as the treatment includes identifying and restricting access to privileged utility programmes.,,,,,,,,,A.8.18
169,May-25,Static,CISO,Business information,Employees,Lack of network segmentation allows attackers or malware to move freely across systems.,"Widespread compromise, data loss, or business disruption during a security incident.",Network segmentation is enforced using VLANs and firewalls. Access between network zones is restricted and monitored. Regular network reviews are conducted.,4,3,1,8,1,8,Retain,,,,,,,,,,A.8.22
170,May-25,Static,CISO,Business information,Employees,Users access malicious or inappropriate websites due to insufficient web filtering.,"Malware infections, phishing attacks, or data exfiltration, affecting system integrity and confidentiality.",Web filtering is enabled on all endpoints and network gateways. Access to known malicious or inappropriate sites is blocked. Web filter logs are reviewed regularly.,3,4,3,10,2,20,Modify,"Web filtering needs to be deployed and enforced centrally, current efforts are applying only low intelligence and small scale protections, but the protections and restrictions need to be more robust.",,,,,,,,,A.8.23
171,May-25,Static,CISO,Business information,Employees,Systems are designed without considering layered security controls or secure engineering principles.,"Increased susceptibility to sophisticated attacks, leading to breaches or prolonged compromise.",Secure system architecture and engineering principles are documented and applied to all new system designs. Design reviews include security considerations and are signed off by the CISO.,4,3,3,10,1,10,Retain,,,,,,,,,,A.8.27
172,May-25,Static,CISO,Business information,Employees,"Developers introduce vulnerabilities through insecure coding practices (e.g., lack of input validation).","Exploitable weaknesses in applications, resulting in data breaches or service outages.",Secure coding standards are documented and all developers are trained on them. Code reviews and automated vulnerability scanning are conducted for all development projects.,4,4,4,12,1,12,Retain,,,,,,,,,,A.8.28
173,May-25,Static,CISO,Business information,Employees,Security testing is skipped or insufficient before deployment of new or updated systems.,"Undetected vulnerabilities exploited post-launch, causing data loss or operational disruption.","Security testing, including vulnerability scanning and penetration testing, is mandatory prior to system go-live. Results are documented and remediation is tracked.",4,4,3,11,1,11,Retain,,,,,,,,,,A.8.29
174,May-25,Static,CISO,Business information,Employees,Outsourced developers introduce insecure code or backdoors due to lack of oversight or contractual controls.,"Compromised software supply chain, leading to breaches, data loss, or regulatory issues.",Secure coding standards exist and would be shared with any outsource development teams during technical initiation sessions and prior to production of code. We perform vulnerability scanning on all supplied application software.,4,3,3,10,3,30,Modify,"We have no formal outsource development policies at the moment, though we do not currently outsource any of our development we should prepare for the eventuality to inform any potential business future planning. Implement automatic security scanning (DAST, SonarQube), manual code review (PR), and other build checks prior to accepting code from outsource developers and deployment to live environments. (E I2-468)",4,3,3,10,1,10,N,Retain,A.8.30
175,May-25,Static,CISO,Business information,Employees,"Development, test, and production environments are not separated, allowing unauthorised access to live data.","Accidental or intentional data corruption, leakage, or disruption of production services.","Development, test, and production environments are logically and physically separated. Access controls are enforced and monitored, and production data is not used in non-production environments.",3,4,2,9,1,9,Retain,,,,,,,,,,A.8.31
176,Oct-25,Instance,CISO,Business information,Employees,Non-conformance corrections and risk treatments could be ineffective (though assumed to be effective) because they are not reviewed.,Non-conformances and risks could re-occur (potentially without notice) if assumed controls turn out to be ineffective.,Annual internal audit covers all clauses and controls.,3,3,3,9,2,18,Modify,Add a review process for Non-conformance corrections and risk treatments so that after a period of time from resolution they are reviewed to ensure they have remained effective. (E I2-478),3,3,3,9,1,9,Y,Retain,A.5.27
177,,,,,,,,,,,,,,,,,,,,,,,,,
178,,,,,,Failure to enforce access restrictions and timely removal of permissions,"If access to critical systems is not effectively controlled, outsourced developers or internal users may retain or gain more privileges than necessary, potentially accessing or altering sensitive information or system configurations beyond their remit, even after their engagement ends. This could result in data compromise, service disruption, or regulatory non-compliance.","NDA in place, IAM roles, MFA enforced, least-privilege policy, quarterly access review",,,,,,,,,,,,,,,,,"A.5.18, A.5.19, A.5.20, A.8.16"
179,,,,,,External developers mishandling source code or credentials,Code or secrets leaked leading to compromise of production environment,"NDA in place, access restriction by repository, 2FA, audit logs",,,,,,,,,,,,,,,,,"A.5.19, A.5.20, A.5.21, A.5.22, A.8.25"
180,,,,,,Poorly controlled third-party access or weak contractor oversight,"Inadequate monitoring of third-party access could allow outsourced developers to bypass security processes or misuse repositories, leading to source code exposure or leakage of credentials and internal documentation.","NDAs in place, code access scoped by project, 2FA enforced, supplier onboarding checklist",,,,,,,,,,,,,,,,,"A.5.19, A.5.21, A.5.22, A.5.23, A.8.25"
181,,,,,,Non-compliance with regulatory standards and data protection laws,"Failure to ensure that outsourced developers adhere to Paythrus PCI DSS and GDPR obligations could result in non-compliance penalties, data breaches, or reputational damage.","Annual PCI DSS assessments, DPA/NDA with all contractors, mandatory training (evidence of training conducted/received)",,,,,,,,,,,,,,,,,"A.5.1, A.5.17, A.5.32, A.5.33"
182,,,,,,,,,,,,,,,,,,,,,,,,,
